title,stories
Belated (almost)homebirth story of Alexander 04-09-'16 (birth pictures added) reeaaally long.,"[('0.3', ""We don't have an OB present unless you're in the hospital. One midwife has medical training, the other is an assistant to both her and you during the labour) who showed up quickly. It was a very sweet older lady who made me feel incredibly comfortable. The entire club was complete at this point and now all we had to do was wait for Alexander's arrival. When midwife2 showed up my contractions had gotten horrible. I was about eight hours into my labour at this point. I hadn't moaned, cried, screamed or done anything other than breathe away my contractions for all these hours. But suddenly I couldn't keep quiet and had to scream through one. The pressure was absolutely intense. The only way I can describe the sensation of transition is to compare it to how your stomach contracts during a violet bout of vomiting. That vice you feel when you gag, but ten times worse and aimed down rather than up. It felt like my hips were trying to make their way out of my asshole. Not that my asshole was particularly painful... just that everything was trying to go down. Now that I look back at that, that was my baby descending quite violently. I went into transition just like that, though sadly at eight centimeters which meant I couldn't push just yet.""), ('0.4', ""I had to breathe/scream/moan and at this point violently puke my way through these contractions, rocking back and forth while sitting on the couch. This was the only way I felt remotely comfortable. I squeezed the living fuck out of my partner's hand (who even though he'd not smoked for weeks, went out for smoke-breaks due to stress - that asshole), and would squeeze midwife2's hand whenever he was away. I just asked her if I could, and if she could motivate me through words. She told me she was amazed I had the guts to even ask her that. But it was what I needed. Take what you need ladies! Between contractions the midwife would check my dilation, and when I was finally at a solid ten I was allowed to push. Seriously ladies, once you are allowed to push things get so much better. The pressure relieves almost immediately once you push along with them and was almost not painful for me anymore. Here's when things went a little less good. I had been pushing for two hours. And he just kept sliding back. He'd gotten stuck behind my pelvic bone, I was exhausted and not pushing right and things were just not happening. They had me hold my own legs as I pushed on my back, laid me on my side and had me push like that.""), ('0.5', ""Even put me on all fours and had me do it like that, all the while Alexander's tuft of hair just kind of sat there not moving anywhere. He'd also pooped as my amniotic fluid started to turn brown...\n\nAt this point the midwife had already called the ambulance, but I had no idea. She told me she would call them about two minutes before they arrived, which was a very smart way to keep my nervousness at bay. I was wearing nothing but a tanktop when I was dragged onto a stretcher and burritoed into a blanket and strapped in. I honestly thought I'd be more embarrassed about my nakedness, though my boobs could've been flopping about and I wouldn't have cared. I just wanted labour to end, I was really tired. The ambulance ride was a little bit awesome, which might sound weird. I had never been in an ambulance in my life and it had it's sirens on, disregarding traffic rules and everything. My partner was in the front and though he was worried, also had a blast. Not often you get to rie one! I was wheeled up to a delivery room and crawled onto the bed. My legs were put in stirrups and they put an IV in my hand to start administering something to intensify my contractions. Though things were progressing incredibly fast from that point onward, making it so that I had no need for any medications and the IV was for nothing (bahhhh!). The shaking in the ambulance had helped Alexander pass underneath whatever he was stuck on, and within twenty minutes I could feel what they call 'the ring of fire'. Honestly it didn't hurt that bad.""), ('0.6', ""It was kind of like pooping out a big poop and your asshole screaming at you not to. I just pushed through the pins-and-needles sensation and could feel the exact moment when his head came out. one second later the rest of his body followed and he was placed on my chest. He came out at a good 3985 gr... I forgot how tall he was! Honestly I was a little disgusted and even though I thought I would, didn't feel a sense of overwhelming love. He was incredibly warm, wet, with sticky vernix and poop all over his back. My chest was stained with blood, poop and... bah. I was just happy it was over. He was born about a quarter to two the afternoon after my water broke. A relatively short labour for a first baby according to my midwives. They took him away to get him clean, get his APGAR scores, weight and height and clothes. I missed this entire process as I was just too tired to pay attention. I was also being stitched up as I had a second degree tear. After being stitched I was helped out of bed to take a shower, and this was the moment I realised how absolutely awful I felt.""), ('0.7', ""I was absolutely exhausted, starving and nearly unable to balance myself on my jellylegs. I tried to shower on my own first but eventually caved and asked a nurse to help me wash myself. I was shaking and pale and... ugh. I hadn't even looked at my baby properly yet, I just wasn't ready. The nurse helped me dry off but the second I took a step I just started bleeding again, covering the entire shower. It was horribly traumatic for me to be standing there, already having a poor self image due to me being overweight with floppy breasts and massive stretch marks, violently bleeding out of my vagina and being washed and dried off by a stranger. This was NOT the calm, peaceful homebirth I had in mind and it made me a little sad. Once I had some clean clothes on and a thick pad in my underwear, I returned to bed and tried to breastfeed my baby. I was still starving and shaking from exhaustion, which made me unable to put in a great effort. I just couldn't get him to latch and I was getting frustrated. I had absolutely no intention to start formula feeding as I was well-informed about it taking a while for my milk to come in, potential weight loss in my baby and yadayada. I was determined to make this work so I had a nurse fetch me a nipple-shield. After two hours we finally got him to latch for his first feed. When he fell asleep I could finally eat. At around five thirty my father picked us up with his car (we don't have one).""), ('0.8', ""I had Alexander on my lap in his car-seat, a baloon with 'It's a boy' on it strapped to the handle (my partner and father bought this for me as I was being taken care of) while riding in a wheelchair. Seeing the way other patiens and visitors looked at me with endearment and compassion made me feel so much better. I started to feel proud. The following ten days were a very fun period for me. In The Netherlands we get what is called a 'kraamverzorgster' which just translates to nurse according to google translate (literally it's like birthing-caregiver or something like that), to take care of the mother and baby for about a week. She taught me how to bathe Alexander in his tub, change him, dress him, hold him etc. I barely held Alex during that time because he was so small-looking. I was afraid I'd break him! My caregiver was incredibly friendly and understanding of my desire to breastfeed. Even though he started losing a worrying amount of weight, we still pushed on to get him to latch right and drink effectively. He was a very sleepy baby and would fall asleep after a couple of minutes. He was also very difficult to wake up! I also have gigantic 85N boobs which would completely smother him unless I held them up while feeding. It looked like it wouldn't be going anywhere. Eventually he had lost ten percent of his birth-weight which was a little scary.""), ('0.9', ""My caregiver recommended my partner to buy me a manual breast pump to at least bottle-feed him some milk during our attempts to get this breastfeeding thing under control. Pumping extra caused my supply to go up tremendously which made my boobs ROOCKK HAARDD for a day. I pumped them emptyemptyempty once and the next day they had chilled out. Baby was also putting on weight again with the extra bottle-feeding. Now it's been 11 weeks and five days since the birth. I can't believe he's almost three months old already. He's a chubby baby now with a lot to say, a lot of poop and a lot of drool. We've mastered breastfeeding and he's gaining normally which is an incredible relief. He was a champ during his first few vaccinations (never suffered anything more than the initial jab) and is just a happy baby overall. I could not be happier!"")]"
Maya's birth story - at home water birth,"[('0.3', ""But she was OP and on the next contraction she shot across the pool. Along with a massive bloom of blood that followed. As planned, my wife caught the bub and it was when she brought it to the surface that we found we were having the girl we'd hoped for. Absolutely perfect in every way. Cried instantly but was soothed so quickly by mum's touch. She came out alert, calm and aware - and seemingly interested in everything. I have a photo that I can't share, of my wife cradling our daughter in the moments after her birth, the biggest smile you've ever seen combined with the look of triumph you expect only on the faces of professional athletes.""), ('0.4', ""But the blood had the midwives worried, so they got her out of the pool. We found out later that she'd torn fairly massively inside the birth passage and severed an artery. They lay my wife down and tried to find the source of the bleeding, which didn't look terrible at this stage. But the placenta wouldn't birth. I thought that the big red chunky things they were filling a surgical tray with was the placenta. Turns out it was blood clots. They tried syntocinon and another drug and had started on further active management of the third stage when my wife turned white, started fitting and lost consciousness.""), ('0.5', ""She came to fairly quickly, but we'd already called the ambulance while the midwives phoned ahead to the hospital. My dad came over and we bundled my boy into his car with a hasty assortment of clothes, nappies and milk. The EMTs arrived, all huffy about attending a home birth gone wrong, until they realised that the midwives had done everything they themselves would do, that my wife had been stabilised and that they were only needed for transport. They relaxed after that. While they took her to the hospital, I followed driving my newborn. She was so quiet and calm I had to keep stopping the car to check she was ok.\n\nMy wife had convulsed twice more on the way up and the bleeding had started up again. When I got there, she had what looked like half a dozen people working on her.""), ('0.6', ""She was conscious and about to be wheeled into surgery. Until they took her away, she got some skin to skin with Maya. And just like last time, I was alone with my newborn while my wife was in surgery. I took off my shirt and got some warmed blankets from the midwives and my daughter and I had skin to skin while we checked each other out. If she cried, I let her suck on my pinkie (properly cleaned, of course) which soothed her. In fact, she barely cried at all, just looked about, slept and sucked dad's finger. My wife came out of surgery at about 10:30 or so - three hours after she'd given birth and Maya was finally able to have her first feed.""), ('0.7', ""Turns out that her placenta would not detach for the docs either - drugs didn't work, active management, nothing. All in all, she lost a little over 2.5L of blood - they said her haemoglobin level was just under '75'. I really thought I'd lost her this time. She stayed in hospital until yesterday after having a transfusion the day before. She's exhausted and sore. But our little girl was born 4.05 kilos, 54cm long and is an excellent feeder. She's calm, happy and alert and loves cuddles.""), ('0.8', ""And despite the trauma of the birth, it's excised the lingering pain over my son's birth - even though it didn't go as planned, we knew the risks and understood the ramifications of our choices. It made it easier that this was our choice, rather than something that was forced upon us. The labour was easy and beautiful, the bub came out pink, calm and happy - a far cry from the induced birth of my son. We had a great midwife team who knew when to pull the plug - and called ahead, speaking personally to the doc at the hospital so he knew what to expect. Would I advocate for homebirth? Absolutely - in low risk pregnancies with an experience and qualified midwife team and a nearby hospital. Would I want to do it again?""), ('0.9', ""I think my wife is now firmly high-risk. I know this isn't AMA, but feel free."")]"
"Golden Elizabeth's Birth Story (positive, unmedicated, at-home, long)","[('0.3', ""At around 3am, the lightening had passed so I went upstairs with my husband to labor in my bathtub a bit, and my contractions got really intense. I don't know if I'd describe them as all pain, more so than an intense pressure that was consuming, with a painful undertone. I kept focusing on the fact that the contraction would end and to just make it there. When we came down from the bath, Nancy checked me again, and I was at I believe, 7cm and she decided to work the scar tissue again. This was around 4am, and it was the fucking worst. But she got it to release I continued to labor on the couch for another 2 hours. At 6am, she broke my water, which pushed me to 10cm, and shit got real as I hit transition hard. I remember asking her if it was going to get worse (she said no) and if she thought I'd be in labor another 12 hours....or 6 hours....or 4 hours....I was starting to get into my head pretty hard about the process.""), ('0.4', ""I was using the stairs and yoga ball to cope with the contractions at this point and I was just consumed by the horrible pressure and pain. My husband started filling the large birth tub in the living room and I was experiencing intense sweating and heat so I didn't want to get in it when it had filled enough. I kept asking if ice could be put in it, lol. My husband and sister kept bringing cold rags for my neck and body, trying to cool me down. The contractions at this point literally consumed me. I was gripping the tub and pushing against it with my feet in an effort to ride the contraction and looking back, I was fighting them instead of letting go, but honestly I couldn't have done differently, the intensity of what I was feeling just overwhelmed me, but true to what I'd been told, when you feel like you can't do it anymore, you're almost done. I was totally taken back by how much painful pressure I felt in my butt, and I was very vocal about this. My midwife then had me get out of the tub so she could apply better counter pressure and to try the stool a bit before using the tub again.""), ('0.5', 'I asked her if she thought I could just get out and not have to get back in, did she think I could have the baby without having to get back in the water- I was really focused on benchmarks, lol. I got out of the tub and she told me to get on all fours, which felt impossible, but she was great and told me basically to do it anyway, which I did, and I labored like that through 3 contractions while she and my sister provided counter pressure, which was very helpful. I was super overwhelmed with how I was feeling, and the adrenaline from transition was really difficult for me, I was sweating buckets and so damn hot. At this point, my midwife wanted me to get on the birth stool with my husband behind me on the couch and she asked if I wanted a glass of wine to help chill out a bit before we started pushing, I was really overwhelmed with all the sensations. I asked her if I could have a shot of whiskey instead, so my husband brought me a shot of Wild Turkey and then we got down to business. Pushing was incredibly difficult. I had expected to feel progress of the efforts, but it was all just one tremendously overwhelming feeling of pressure throughout my entire pelvic region coupled with having to expend an almost supernatural strength in bearing down. I felt the contractions and efforts of pushing everywhere in my body.'), ('0.6', ""Continually looking for benchmarks, I asked my midwife if it would be over in ten contractions, and she kindly laughed and replied that if I made them good ones, but that was up to me. Nancy was amazing and lead me through how to push, how to make use of the strongest contractions, and when to back off to allow try to prevent tearing. She was kneeling in front of me, applying warm compresses which had been warming in a nearby crockpot. She was also liberally applying oil and helping to ease the skin. This was really hard work, literally the toughest thing I've ever done. I felt like I couldn't do it through most of it, but everyone there in support of me kept encouraging me and tending to me, that I was doing it anyway. I occasionally stood up and stretched during this, in between contractions, which felt good, and I was surprised I was able to do at this stage of labor. My midwife asked that I shimmy off the stool a bit and do a proper squat, to which I was like no fucking way, anything that increased the pressure was unthinkable!""), ('0.7', ""But then she told me the effort of one push there could be equal to 10 pushes on the stool, so I dropped and did it. I got back on the stool and Nancy told me to put my hand on my vagina to feel the stretching on top, in an effort to not tear and push to much. I was spent at this point, even though pushing start to finish only lasted an hour and a half. My sister was telling me how much she could see, and told me she could see the hair of the baby poking out. The next few pushes are a blur, she hadn't crowned yet and then all of the sudden, she came out completely in one big push. I was shocked both by it happening so quickly and by the full head of hair on our baby. I was in utter shock and disbelief at what we had just accomplished and I looked down at our daughter, Golden Elizabeth in awe. My husband was wrapped around me and put his hands over mine and we gazed at our baby in utter delight and surprise.""), ('0.8', ""My sister had been and was continuing to snap pictures (which I had said I didn't think I'd want, but I'm glad my midwife had told her it was time to grab the camera when she did). Nancy had me focus on the next contractions so we could delivery the placenta. I asked her if it would hurt again and she told me no, it would just feel like a wet burrito sliding out. I gushed what I thought was a ton of blood into the waiting bowl beneath me and probably within those first ten minutes, delivered the placenta. From there, I made my way to lying down on the couch, skin to skin with Golden as we waited for her to latch. It was such a surprising and lovely sensation, to have labored and delivered our baby in the living room with such intense energy, and for that then to dissipate as we all settled in awe and wonder. Nancy massaged my uterus which was also not the greatest, but she was making sure I was contracting smaller and that I didn't overly bleed. When it was time to cut the cord, my husband commented that it was a lot more difficult to cut through than he expected.""), ('0.9', ""Once this was done, Golden went to my husband for skin to skin while Nancy and my twin sister tended to me. In between them during all of this was my dog Norma, who calmly and diligently offered her presence in comfort through the entire labor. Nancy let me know that she needed to check if my tear needed stitches, which I was surprised to hear, because I had no idea I'd torn and couldn't feel that it'd happened. Nancy decided to do a few stitches, it was a second degree tear at the bottom of my vagina. Once I was all set, I was led upstairs to a drawn bath with all the herbs Nancy had made a strong tea with (I don't recall everything that was in it, but it had a good deal of powdered clove, which turned the bath water a dark murky brown). I got in the tub and lounged like this for a while, which is when my mom arrived and joined me on the bathroom floor, telling me how shocked and proud she was. Once out of the bath, I got in bed and my husband brought me Golden and we settled in. I'm writing this on the one week anniversary of when I went into labor, and I have been enjoying staying on somewhat bedrest up with our new baby and my husband. Giving birth was one of the most tremendously intense experiences of my life, and I still find myself in disbelief that I did it. [Baby tax!] (https://imgur.com/a/BeXRwuA)\n[Baby tax: Day 5] (https://imgur.com/a/qxWtODl)"")]"
Birth story - unexpected home birth!,"[('0.3', ""I really had to pee, but every time I got up, I would get a really strong contraction. Eventually I couldn't lie down any more, and had to walk around. My husband was timing the contractions, and once I got out of bed, they quickly increased in intensity and were coming roughly every 2 minutes! I rang the midwife at 3.20am to let her know how close the contractions were, and she said it was time to go and she'd meet us at the hospital. After hanging up, the contractions got extremely intense, I couldn't stand through them, and was moaning.""), ('0.4', ""Mum arrived a couple of minutes later and my husband woke our son, and took him out to the car. They left, and my husband was rushing around putting our bags into the car when, I suddenly realised that we wouldn't make it to the car let alone the hospital. I had one super intense contraction and felt the baby move down and quickly called out that the baby was coming! My husband thought I was exaggerating, but on the next contraction, my water broke and out flew our wee man! I caught him in my pants and my husband grabbed him and passed him through to me.""), ('0.5', ""We were in shock at this point, and I had to instruct my husband on what to do - he was a bit panicked, but thankfully the baby came out screaming, and was a nice pink colour. We wrapped him in a towel and\xa0rang the midwife to let her know what had happened. She was 10 minutes away, and came straight to us. In the meantime, I rang my mum and asked her to come back as the baby had arrived! She couldn't believe it, she was only 2 minutes away from the house before we rang with the news, so things really had happened quickly!""), ('0.6', ""I was still in a bit of pain, and was bleeding, so Mum (who is a nurse) and husband grabbed towels and tried to clean up a bit. Thankfully I had moved to the tiled hallway on the way out the door, instead of the carpeted lounge! When the midwife arrived, she delivered the placenta which was fine, it just slid out when she asked me to push. She was going to cut the cord, but didn't have anything to clamp it with, so we ended up putting the placenta into a plastic bag and carried it with the baby to the hospital! I wanted delayed cord clamping, and this was very delayed!""), ('0.7', 'During all this, our other son was waiting in the car outside. My husband went out to talk to him and let him know that his baby brother had arrived - he was more excited about the fact he was going to Nana\'s house! He was really good, although he must have heard at least one contraction before he left, as he kept talking about how ""Mummy had a very sore back at night time"" for a few days afterwards. Thankfully we only live a 3 minute drive from the hospital, so we bundled into our car, with the baby wrapped in a towel and sitting on my lap. The midwife met us there and we were taken to a delivery room to have the baby and me checked over.'), ('0.8', 'He was 8lb 4oz, a decent size. We were both fine, no tearing for me which I was amazed at due to the quick delivery - I had a second degree tear last time, with stitches, and was so happy to avoid them this time! We stayed in hospital for 2 nights trying to get feeding established, but we are now mixed feeding, as I am not producing much (possibly related to PCOS - it was the same with our first born) \n\nPost partum, I am feeling great, hardly any soreness at all, and generally feeling well, after a few emotional days after returning home. Wee man is now 12 days old and is slowly settling into a rhythm. I have found that sleep timing is the key - not having too much awake time - if we put him down 5 minutes too late, he will be awake for a couple hours, but if we find the sweet spot (for him, usually about an hour after waking) he will drift off to sleep in 5 minutes or so!'), ('0.9', ""Thanks for reading this novel, I hope some of you find it interesting - it was definitely not the birth experience I was expecting, but I wouldn't change it for anything! We are very thankful that everything went well and our wee man is happy and healthy."")]"
