title,stories
"Long birth story of Emily, born at 38+1, STM, unmedicated home birth","[('0.3', ""In the following night I woke up at around 1 am to the strange sensation of something wet running down my leg. It wasn't much, but I was pretty sure it wasn't pee. I went to the toilet, peed and saw a really small amount of blood. Back in bed I couldn't sleep with thoughts about induction, c section and other interventions running through my mind. About half an hour later my son woke up and I went to check on him. He just wanted some cuddles so I went back to bed but now the Braxton Hicks contractions I had since almost the beginning of the pregnancy started to become pretty regular and a bit uncomfortable.""), ('0.4', ""My son came to our bed shortly after because he couldn't sleep and there I was, trying not to move around too much while my son was falling asleep next to me. As soon as he slept I stood up because I was just too uncomfortable and went to the living room. It was around 2am at this point. I spent the next hours alternating between pacing around, on all fours on the couch and lying on the couch to get some rest. The contractions were about 5 to 10 minutes apart and slowly increased in strengths but I was sure I was still pretty early in labor so didn't want to bother my husband or my midwife. The whole time I was binge watching a cooking show on Netflix to keep me awake and distracted between contractions.""), ('0.5', ""At around 7am I went to take a shower. The warm water was great but I really had to hold onto the wall and vocalize a bit when a contraction hit me. At this point I told myself that I would call the midwife once my husband and son were up and in their way to Kindergarten which was around 7:45 am. As soon as the midwife heard me having a contraction on the phone she said she'll be on her way. 20 minutes later she and my husband arrived almost simultaneously. I was moaning pretty loud by now and the contractions were about three minutes apart.""), ('0.6', ""The midwife checked me immediately and I was so surprised and relieved when she told me I was already at 7 cm dilated. It made me pretty euphorious actually and a bit proud that I had managed to get this far without help. A few contractions later I started to feel some urge to push, at which point the midwife got slightly hectic because she wanted me kneeling on the floor in front of the couch for the pushing phase. Now it got really uncomfortable. Not painful per se, just incredibly intense. I didn't have much time to rest between contractions and held onto a large pillow (I got really bad muscle soreness in the neck, shoulders and arms from that).""), ('0.7', ""I planned to not scream this time during pushing but couldn't help it, it was just too intense. The amniotic sac was still intact so the midwife opened it. I could feel the baby move down and the midwife checked regularly how she was doing and she was doing just fine, but the midwife still urged me to push a bit more because she didn't move much further for a few contractions. It didn't really worked so she wanted me to stand up in front of my husband with my back to him (this was not easy, my legs trembled a pretty bad), and with the next contraction she told me to go to a low squat and push hard. It was even more intense but I could feel that the changing of position worked. With the next contraction the head started to crown and I had to convince myself to push nonetheless.""), ('0.8', 'Two or three contractions with pretty hard pushing and whining from me the head was born and with the next one baby girl was here, at around 9am, which meant I pushed for about 30 to 40 minutes. The relief came instantly. I felt great, sitting down, cuddling my baby girl which cried immediately after being born. The midwife gave us a lot of time to cuddle before cutting the umbilical cord. I still had some contractions every few minutes which were not too bad but pretty annoying. The placenta was born after about 30 minutes I think and was complete.'), ('0.9', '')]"
Birth story [TRIGGER] how do I get through leaving my preemie in the nicu while I'm already home and heartbroken?,"[('0.3', ""So she puts the heart monitor on my belly and .... his/the baby heart rate is THERE AND IT'S NORMAL! I got there in time! I can't tell you the relief that gave me...I didn't care what happened to me, but please let the baby  be first priority! My OBGYN arrives in under 5 min and does a quick check of everything. I was already dialled to a 3 and 90% effaced.... BUT the prognosis was I had placental abruption... the placenta detatched from the uterine wall.... and I had to have an emergency c-section NOW!""), ('0.4', ""My husband was rushing from work to get there, but he wouldn't make it on time cause it was an emergency of course. He was crying and so scared to lose me and the baby... The nurses even said if I had been there 30 minutes later that we most likely wouldn't have made it. The doctors and nurses couldn't believe that this even happened, that it just does cause it's an anomaly,  even though my pregnancy was healthy the whole way through...\n\nthey had the anesthesiologist quickly put a spinal block in so I could see my baby being born thank God. Having a c-section was the weirdest feeling ever! A lot of pushing, pulling, tugging, pressure...I even felt it near my lungs it was really crazy!""), ('0.5', ""So baby comes out and I hear the sweetest littlest cries come out. He's okay and alive. That's all I wanted. His Apgar was a 9. He was 4 lbs 14 Oz and 19 inches long! His name is Ezra Orion [last name]❤\n\nBut...his lungs weren't ready and he declined fast enough that he had to go to the nicu.""), ('0.6', ""I didn't even get to hold him or kiss him once. 😢\n\nSo my baby has been in the nicu since. Ive only got to hold him/ do skin to skin once since hes been born😢. And now i am home already, and had to leave him there, which I am so heartbroken about. It's like he makes progress, and then it's another step back day in day out... though yesterday they said he is improving.... I feel like I'm cut in half and can barely take care of myself the pain is so intense.""), ('0.7', 'So recovery has been and still is really hard on me... but the hardest part is not being able to have my baby home with me! I feel so alone and sad....I need him. It\'s not natural to not have your baby close and with you after birth! I mean they don\'t suspect him to be in there too long since he wasn\'t super early as some babies, but we still don\'t know WHEN because he has to improve and be able to keep a steady temp, feed normally from breast/bottle or both, fit in his carseat, etc.... so idk....\n\n\nAlso, my two older boys saw everything that happened until I was wheeled away for the c-section, and are kinda scarred from it so I feel horrible! Especially my 5 year old he told me "" I saw all that blood and didn\'t know what was going to happen to you mommy"" and he has been pretty emotional towards me. That is my birth story sorry if it\'s jumbled I\'m just a wreck right now...\n\nHas anyone been through this, or something similar?'), ('0.8', ""How do you get through it? Any tips or know what I can  expect next? I just feel so empty and alone without my baby and could use some words of wisdom, comfort, advice or anything really..... If I left something out just ask...it's my first time posting an actual post, and hope I did it alright! Thanks for reading... it means a lot! [Also how can I post a picture of my new baby?]""), ('0.9', 'Baby Ezra photo album:\n\n https://imgur.com/gallery/OcXB1\n\n[Is this how I post pictures of him? Is this allowed?]')]"
"Graduated Dec. 21 - Major line jumper, guess whose due date was wrong? Happy unmedicated home birth!","[('0.3', ""I ended up hopping in my own bathtub and making my SO call the midwives to tell them I was trying to slow labor down. That sped it up. Birth assistant arrives, I'm leaning over my bed with every contraction. Midwives arrive within 5 minutes of each other. Dr. L is taking my vitals and I honestly don't remember much about that because I had my eyes SHUT. Contractions were right on top of each other already.""), ('0.4', 'Apparently I kept saying ""I just need a break"" over and over. The tub was finally set up and running and I practically sprinted into it. Instant relief, but it was only momentary. I immediately needed to push- and I did. I was actually drifting to sleep (for about 15 seconds) between contractions- I closed my eyes with daylight and opened them again and it was completely dark outside. Squatting in the tub also really messed up my hip because I was in a super weird position- SO was in the tub with me but I still couldn\'t hold on to anything well enough to bear down, even the tub wall.'), ('0.5', 'They got me out of the tub to avoid dehydrating me too much, as I was starting to get really really shaky (my face was even shaking). They ran an IV in my room. The contractions were so bad that I actually ENJOYED them placing the IV because it was distracting. Well, it turns out I had just the tiiiiniest cervical lip, and that was effectively sling-shoting baby back into me after every push and preventing any progress. So I ended up pushing for approximately six hours. So at this point a midwife goes ahead and manually pushes my cervical lip aside (oh my god, agony) and we get things moving.'), ('0.6', 'They actually got me up and had me on the toilet for a few pushes which is how I managed to get some crowning action before I got back in bed. I was kicking like a mule and wound up making the most progress on my back, which is generally considered WAY harder to birth in than side, squatting, etc- but so it goes. I actually had a birthing assistant play tug-of-war with a towel to bear down, and that\'s how I got most of his head out (giant cone head baby, naturally). SO guided his head out with flat palms, and at this point I was instructed to do small, controlled pushes to prevent any tearing. Once his torso was out, they told me to ""reach down and touch your baby"" and I HEARD ""reach down and GRAB your baby"" so I just grabbed that sucker under the arms and pulled him the rest of the way out and on to my chest, much to everyone\'s shock. Apparently that has not been done out of water before in the practice (because why would you!?).'), ('0.7', ""I wasn't really worried about though because I needed the placenta OUT OF ME. SO delivered my placenta and at long last, relief. Glorious, glorious relief. At 7lb 11oz, this kid is far from premature- He even scored 40 weeks during his check up. After 20 minutes he was breastfeeding like a champ. No idea how it got dated so wrong, but I'm a happy camper!""), ('0.8', ""He's absolutely lovely Totally worth it- I do wish I'd had a little more time in inactive labor so that things would have happened a little more gradually, but overall I'm just glad he's here! He's so fuzzy! Here he is mid poop, I'm guessing. ;) http://imgur.com/JN5uZkR""), ('0.9', '')]"
baby D is here! our home birth story,"[('0.3', ""My midwife team (3 amazing ladies) showed up around 9:30pm, because the drive was so far they didn't want to take a risk of cutting it too close. Upon their arrival, they checked my dilation and I was at 6cm. They had me get out of bed and walk around the house while my husband set up the birth tub in our back yard underneath our apple tree (yes, I know hippy dippy, but it sounded like a romantic plan with candles and Christmas lights hanging from my apple tree. Haha) \nAnyways, after walking around and crying through contractions for another few hours, the birth tub was unable to be filled because my hot water heater decided to take a crap on us right when we needed it most! Thanks old-as-shit water heater...""), ('0.4', 'So, I decided just to labor it out in my bath tub inside the house. Contractions got to the point that just crying through them was no longer helping and I needed to scream them out like a wild banshee. About an hour of this and I was fully dilated. This was about 1am on the 20th. I got out of the bath and went to my bed, midwives checked my cervix and I was ready to go.'), ('0.5', ""I couldn't comfortably get my bearings to push while laying on my back. I tried pushing once or twice from the bed, when my water finally broke. After my water broke I told the ladies I would prefer to be squatting, so they helped me out of bed and I knelt down on my knees and started to push with each contraction. The baby was moving down the birth canal a fair amount each push, and I was able to reach inside my vagina and feel its head. (We had decided to wait until birth to find out the sex, which is why I'm still referring to it as an it at this point in my story).""), ('0.6', ""It hurt so bad I was biting my wooden bed frame I was kneeling over, and my bed now has several bite marks along the side, ha! I had my arms wrapped around my husband's waist who was sitting my front of me while I buried my face in his belly and screamed bloody murder with each push and contraction. I probably pushed like this about 5 times. The midwives asked me to stand as I was I able to push the baby's head out and with one more push while standing, I gave birth to a beautiful little boy. We immediately laid down on the floor, which the midwives had covered in waterproof pads and sheets for us.""), ('0.7', ""I was so happy to finally have him out and in my arms, I wasn't even concerned to find out his sex for another fifteen minutes when I finally thought to look while the midwives stitched up my minor tear. It was a super amazing experience and I'm so happy that I stuck through it to the end. Once I hit transition I was sure that my life was over and I was going to die right then and there. And I'm not going to lie, in the midst of pushing I cursed myself for deciding on a homebirth and not going to a hospital where they could freely administer pain relief drugs at my whim (although at that point it would have been too late anyways). I'm so proud of my husband for being my rock that entire day, and he never left my side.""), ('0.8', ""Actually, he left the room once to fill my water bottle and I swear the contraction I had while he was gone was a million times more painful because he wasn't there to hold my hand. So baby D was born at 2:36am on the 20th at 8lbs 11oz, and 21in long. This past week has been amazing, even on the night I held him and rocked him all night because he was screaming from gas pains because I mistakenly had eaten a spicy meal earlier that day without thinking about what it would do to my poor little guy's belly. Breastfeeding is going fantastic, and he's wide-eyed and curious about the world already. Our lives have changed for the better in so many ways since his arrival, and I'm so thankful we were able to do it our way without having to be transferred to the hospital.""), ('0.9', ""Thank you ladies for the 9 months of support, I couldn't have done any of this without you here to keep me company. Especially the first 7 months of extreme HG. Thank you, thank you. Edit: pics\nhttp://www.imgur.com/Rqwl4.jpeg\nhttp://www.imgur.com/cEPaZ.jpeg"")]"
[Birth story] Planned home waterbirth turned hospital birth with a bit of a surprise.,"[('0.3', ""Midwife said to go for it and start pushing if thats what my body was telling me to do. Ive only been in labour 2 hours and I didnt fancy pooping in the pool, but fuck getting out. I start pushing like I am taking the biggest poop of my life. It felt a lot better than the contractions and that surprised me, but I found it really difficult to breathe while pushing. After 2 hours of pushing the midwife said she didnt think he was going to come out in the pool and told me to get out. I didnt want to so we tried a couple of pushes standing in the pool. I shouldnt be so stubborn, suddenly my legs start shaking uncontrollably, I think I am going to fall over. Husband and midwife help me out and over to a birthing stool. She wants me to try pushing on that for a bit, husband is behind me holding me up, I am shaking all over, naked and wet. I push and push and suddenly there is a head coming out of me. Im still feeling a bit high from the gas. I didnt feel the ring of fire. One more push and he is out on my chest. 'He looks like me and you mixed together' I tell my husband. Am I squeezing him too tight? Hes slippery and covered in blood.""), ('0.4', 'I dont want to drop him. 4 1/2 hours of labour. That wasnt so bad. Suddenly it sounds like someone has turned on a tap. I look down and there is red everywhere. My midwife tells the student to ring the emergency bell. Why is there red everywhere? Student is having difficulty getting the bell to work. I tell her you have to push it 3 times in a row. Hurry up student, the floor is messy. About 20 people rush in. I am naked, why are they all here? I dont want them all to see me naked. There are people either side of me. Someone is putting something in my leg, someone is putting something in my arm. My midwife is pressing on my stomach.'), ('0.5', 'Everyone is talking at the same time. They tell me to get on the bed. Someone takes my baby. They lift me onto the bed. I tell them to take my blood pressure. I dont feel so good. There are hands inside of me. There are hands on my belly. They are all pushing. Something is squeezing my arm. Everyone in the room is doing something in a hurry. Where is my baby? Why does my husband have his shirt off? They tell me he has to do skin to skin because I cant. Is my baby ok? They tell me I have lost a lot of blood.'), ('0.6', ""I hear the word 'ICU' and they say I need emergency surgery. They are going to knock me out. I tell them no. I had this baby without medication (well a bit of gas) and I dont want any now. I am afraid I wont wake up. They say they can give me a spinal instead. Someone tells me the blood is from a 3rd degree tear, a tear in the babys cord and from the placenta coming away. They are giving me IV fluids. Someone is cleaning the floor. Someone is pushing me into the OR. I ask if he is having a good day. He tells me its been ok. Thats nice. I tell him where to go. He says he knows where to go. I recognize 2 of the people doing my surgery. I tell them sew me up tight and do a good job.""), ('0.7', 'Where is my baby? Husband and baby arent allowed in surgery. Is someone looking after husband? Does he even know what to do with a baby? He will be scared. That makes me scared. I am wheeled back out to recovery. I look at the clock, Ive been in surgery 3 1/2 hours. Hope husband hasnt forgotten about me. Get back to room. Not feeling high anymore. Get to see my baby. Thats not my baby. Husband why are you holding that baby? He tells me it is our baby. I dont know, hes got a different hat.'), ('0.8', 'He tells me the hospital put it on him, he couldnt find the hat in my bag. I dont feel myself mentally, I feel really confused. We try breastfeeding and I try and sleep. Keep having flashbacks of blood and hands inside me. I can feel the hands in me, on me. My heart keeps racing. They say they think I might have PTSD. The next day is a blur. I eventually discharge against medical advice. This place is freaking me out. I need to get home. Things get much better once we got home. Eventually the PTSD subsided after a couple of weeks  and much talking it through. I dont get flashbacks very often anymore and I can now think back on the birth positively. Everything has healed up and me and baby boy are doing really well. Overall  A ++  labour and birth, would birth again.'), ('0.9', 'TL;DR: Planned home waterbirth turned hospital birth. 4 1/2 hours labour mostly medication free. 3rd degree tear and PTSD. All good now though.')]"
"Birth story: spontaneous pre-term labour, far from home","[('0.3', ""I was having contractions just a few minutes apart. Baby was coming, and soon. They gave me steroids for the baby and magnesium sulfate and something else that I still don't remember, but it made me feel very hot. The goal was to slow down labour long enough for a pediatrician to come from another town, or better yet for a paediatric team to make it from the city. Things were moving too quickly for a medical evacuation to be safe.""), ('0.4', 'They were pretty pessimistic about the situation. I was taken down to the delivery ward and they tried to keep me calm and still. I got instructions like ""if you feel the need to push, don\'t."" I was offered some gas and my husband (who was even less prepared for this whole labour thing than I was) did an amazing job alternating between helping me with the gas during contractions and giving me sips of water between them. In the brief gaps between contractions the midwives tried to reassure me.'), ('0.5', 'It was like I was having my head held underwater, then coming up with just enough time to catch my breath before being pushed under again. The contractions began to run into each other, and the obstetrician began to be concerned about impact they were having on baby. The pediatrician arrived at 7:07am, and the obstetrician promptly broke my waters. A few pushes got baby down into position and crowning, and one last push delivered our little boy into the world at 7:20am - all in one go, like he was being shot out of a cannon. Thankfully no incision or tearing, even coming out posterior facing.'), ('0.6', 'Baby was moved onto the station that had been set up. They told me he was a boy, and I had a moment of gender disappointment knowing girls have better outcomes at this stage. Thankfully they were able to get him breathing as I delivered the placenta at 7:25am. We got about a minute of skin to skin, then I was rushed away to recovery while they worked on him. The medevac team arrived not long after and stabilised him over the coming hours.'), ('0.7', 'I was basically left to my own devices in my room, as the hospital was not staffed for the drama. Thankfully, physically I was in excellent shape. At about 1pm we were taken to the airport, where I sat in lost-and-found pants and a hospital gown to wait for the plane and my baby in the ambulance. My husband was loaded into the cockpit and me onto a stretcher at the back of the plane, with baby in his humidicrib with three medicos working on him. We were evacuated just before a storm rolled in.'), ('0.8', ""A dramatic start to life for our little man. We were both admitted to a major hospital with the best NICU in the state. Baby is doing really well for such a tiny thing, and I was discharged after two nights. Physically I had no issues at all - didn't even need a peribottle or stool softener. Emotionally, now that's a different story.""), ('0.9', ""But our little boy is doing as well as can be hoped for - breathing on his own (with CPAP) and taking some milk (through a tube). We're taking things day by day and have great support network helping us with logistics and dealing with the emotional ups and downs. It definitely feels like starting parenting life on hard mode, but he's worth it."")]"
