title,stories
My home water birth story!,"[('0.3', 'Her eyes opened wide and she said, ""Holy shit! You\'re 9 cm! Want to get in the pool?"" And hell yes I did. The water felt soooo good. I had been having some back labor and it instantly went away the second I sunk into that pool. She had me hang onto the side and sit in a kind of froggy position for a few contractions to move that final lip of cervix. It was raining and stormy outside and we opened the front door to let the cool air in and listen to the rain. It was really cool having a storm bring in the baby!'), ('0.4', ""I was in the zone and the atmosphere was awesome. Soon after, I felt the urge to push. I pushed the whole time sitting on my knees with my butt on my heels. It seriously only felt like 10 minutes of pushing, maybe like 5 or 6 contractions total. She told me to keep my hand on her head to ease it out. I could feel her crowning and let a few contractions go by to help stretch it out so I didn't tear and let her come little by little. I delivered her head myself and was just kind of shocked at that point. The midwife reached down, twisted her so her shoulders would come out, and then let go, letting me lift the baby out of the water myself. It was the most surreal moment, I couldn't believe that I had just delivered a freaking baby practically myself!""), ('0.5', ""She was born at 7:22 pm. I only had three hours of pain total, and it really wasn't that bad! It's intense, but if you remember to relax and really give into each contraction, it helps a lot. Don't fight it or be scared of it! There was a bit of burning right when she came out, but it hurt a lot less than I expected. She cried just a teeny bit and immediately latched. We waited a few minutes for the placenta, and that came out no problem. We waited for the cord to stop pulsing before releasing her. My husband is pretty squeamish, but managed to cut the cord without passing out.""), ('0.6', ""After that, she helped me climb out of the pool and crawl into bed. She checked me for tears and to my intense relief announced that I only had some road rash and needed no stitches. That was honestly the part I was most scared of. I've never had stitches in my life and didn't want them now. Right after that, my parents arrived! They had perfect timing. They told me that on the way, right before they got into town, pretty much right when she was born, there was a double rainbow, the brightest they'd ever seen. It went over the road from end to end, perfect. People were pulled over on the side of the road taking pictures of it because it was so beautiful.""), ('0.7', ""They took a video of it as they drove to show me. It was a pretty incredible omen to usher in our little lady. The midwife was amazing. She cleaned up our house and drained and put away the pool while we cuddled the baby. It looked like nothing had happened. She cut up the placenta and stuck it in the freezer for smoothies, and then made me one. She weighed the baby, who came in at 5 lbs 9 oz. She was perfect and had the prettiest shaped head :D My husband had filmed the birth and she asked later if we'd be willing to put it up on youtube to encourage others and show how hands-off birthing could be. We fully intend to, after some editing and whatnot, it's a pretty cool video!""), ('0.8', ""Totally not gory or embarrassing. I'll submit the link when we do. So pretty much the whole pregnancy and birth was entirely amazing and wonderful. We went the full-hippie route...no ultrasounds, cervical checks or interventions, and everything was more perfect than I could have hoped for. The midwife was blown away, with this being my first and so smooth. We were all pretty amazed and I felt like a superwoman. It was wonderful having her in our home and not having to go anywhere. I highly recommend it to anyone who can! I wasn't scared at all and I didn't even cry once!""), ('0.9', ""It was the coolest thing I've ever done, hands down. [Baby Wren](http://imgur.com/a/ZL6JZ)"")]"
"My birth story! Baby boy born 6 weeks early, water broke at home, induction, epidural, positive!","[('0.3', '(Spoiler: It was not a week!) All day that first day some scary things  kept happening with baby’s heartbeat with contractions. I ended up having my mom come up to the hospital to bring me snacks and keep me company, even though my whole pregnancy i said i wanted NO ONE there except my boyfriend until we came home. But Luckily she was here with me for a few hours when the first big scary decel happened with his heart at 4pm. The nurses flipped me over and we got him back up and it was pretty much OK for a while. Every now and then his rate would drop slightly and they’d roll me over, move the monitors around and it would come back up to normal. This is why I didn’t sleep for the 2 days I was there before delivery. My mom finally leaves at 630pm. So I order dinner. All i wanted was breakfast food while i was in the hospital. A Law and Order marathon. Have some cervical checks. Wait on my Boyfriend. Do everything except sleep bc how do you sleep when you’re on continuous monitors and nurses are in every hour to tell you the baby’s heart rate is low and to roll over? You don’t! He finally gets here with all our stuff. We are trying to sleep.'), ('0.4', 'Baby’s heart rate keeps dipping so basically every time we doze off, we get woken up. Finally we get moved to my labor and delivery room at some odd hour on Wednesday morning before the sun was up. They finally start pitocin at 6am. And I get like an hour of sleep before I’m awake at 845am for the day. I didn’t nap all day. I can’t eat, only clear liquids. Baby’s  heart hates  the Pitocin and my contractions and continues to dip throughout the day. We start the Pit at a dose of “2.” Then get up to 18 and baby heart drops and stays low. This was very scary. My BF was out having breakfast down the street at this point. The docs and nurses fill the room. Start gowning up and talking emergency surgery. They Flip me over. Get me on my hands and knees, ass in the air. Do a painful awkward cervical check. Push some meds into my IV that relax my belly, but make me shake like a tree. Apparently i was having back to back contractions and baby didn’t like it.'), ('0.5', 'so they stopped the pit. I’m trying to text my SO while shaking like a tree and my ass in the air, with a doctors hand inside me. I guess they were worried about the umbilical cord prolapsing (which i was terrified of bc someone i know had lost their baby a few months before bc of this exact thing). Boyfriend gets my text and runs back to the  hospital. He comes rushing back in the room, crying. Saying his parents are rooting for me. He can be a big softy. I calm him down and we relax. I order some bullshit off the liquid diet menu. Then finally turn Pitocin back on after my baby’s heart rate stays stable for a while but start it at like 8. We work that back up to 20 before baby decides it (we didn’t know what we were having!) I’m having contractions but I’m not in a lot of pain at all. My most discomfort was my butt and low back from sitting in my ass in these terrible beds for 30 some hours. I tell myself I’ll get to a 4-5 dilated and ask for my epidural bc i knew i wanted one. So I get a check around 345 pm and I’m told I’m 4.5 and say ok i will  take it. I’m uncomfortable for a number of reasons that I was just sick of. I was sick of leaking water every time i got up to pee.'), ('0.6', 'But never did the contractions hurt to the point I couldn’t manage them. I felt pressure and tightening and felt a slight burn but not nearly as bad as period cramps. The contraction monitor showed them spiking off the chart but I didn’t feel much pain. I do have a high pain tolerance but didn’t think it would be this easy. I think it’ll take an hour or more to get my epidural but the anesthesiologists were available and came in right away, had it placed a little after 4pm. I hated the procedure. That’s the only time i cried bc of pain and discomfort. It felt like pressure and pain shooting down my spine to my tail bone and i HATED IT. So I’m very glad I asked for it when I did and was able to sit thru my contractions and be still for the placement. I sent my BF out to get some food for himself while i had it placed. The anesthesiologists and my nurses were impressed I was able to sit so still bc my contractions were spiking on the monitor but i just didn’t feel that much pain with \nthem. I had an internal contraction monitor, forgot to mention that. I was watching Netflix and joking w my SO before we got the epi. So I’m so glad I got it when i did. I had the most fantastic epidural. I could still move my legs and feet. But felt no pain.'), ('0.7', 'At first it only took on the right side but they moved it a bit and it finally numbed my left side too. I told my boyfriend i felt so amazing afterwards. It was the first time I could relax in 2 days. My contractions weren’t bad but my back and butt hurt so bad from sitting for so long! I didn’t like getting up and moving around bc I just leaked water and bled. And with my baby’s heart rate all over the place I had to be on continuous monitoring so, bed is where I stayed. So we sit around for several more hours while I make no progress past a 4.5. Me and my SO watch Home Alone then around 11 decide to get some sleep. I wake up around 1am to a nurse wanting me to flip over for the 100000 th time bc baby’s heart rate was dipping. She flips me onto both sides... doesn’t help. After a few times I say “I kinda... feel funny or different on the inside?” She says I’m gonna get the doctor. The doctor comes in. I’ve gone from a 4.5 to a 10 and 100% effaced in 2 hours while i slept and it’s time to have a baby. The doctor says “there’s nothing left, no cervix. Let’s have a baby.” My boyfriend was asleep on the floor and and woke up very confused haha \n\nI pushed from 1:30am to 2:21am, when I had our little BOY! He was only sitting on my chest for a brief second (I couldn’t see his face) bc they were rubbing him and then they had to take him to the table and check him out bc he was 6 weeks early. I didn’t get to hear him cry.'), ('0.8', 'My SO went over and stood with him (looking over at me to smile and give me the thumbs up and say he’s ok) while they got him some breathing help. I got stitched up (2nd degree, they were able to close it with one long stitch. Honestly the stitching sucked the most. I asked for my epidural button). The pushing part was surprisingly easy. I pushed like I had to poop and the nurses and doctors said I was doing so good. It was the boost of confidence I needed. My boyfriend said you could see his head a little bit more every time and then finally his head came out, the doctor said “say hi.... Dad, what do you see? !” And my boyfriend said “it’s uhhhh..... A BOY!” The cord was covering his private’s LOL so he wasn’t sure at first. It was the most thrilling moment of my life. Then the doctors got my baby boy stabilized and breathing and all cleaned up but then had to take him to the NICU down the hall since he was so tiny. 5 lbs 5 oz. I cried a little when they wheeled him over for me to say bye for now, but didn’t cry a lot until I was alone in the room several minutes later once I was cleaned up. Then i called my best friend to tell her we had a baby boy and I SOBBED. I couldn’t believe after 2 days in the hospital that it was all over so fast and I was now alone in this room. So I cried to her for a while and then decided to put some makeup on and feel human again. I ordered breakfast at 6am when the kitchen opened.'), ('0.9', 'Then I was able to take a shower a couple hours later and finally hold my son around 930 that morning. 7 hours after he was born. He only needed a little CPAP oxygen support that morning and was off that by late morning. He did need a feeding tube in his nose and a month long hospital stay to learn how to eat and grow. He is now 5 months old, finally learned how to breastfeed a month ago, and THRIVING.')]"
Finally home with my little lady. Scheduled C section birth story and photos in comments.,"[('0.3', 'They wheeled me down, double checked all my info and explained what would be happening. I met all the OR staff that would be in there with me and they were all super friendly. At 9:47 I was wheeled into the OR and for the first time I started to panic.'), ('0.4', ""I don't think it was outwardly obvious but you could tell by my heart monitor that was freaking out. The doctors kept the atmosphere very light and it helped me a ton. Around 9:50 my spinal block was administered and I have to say, it was not what I expected it to be.""), ('0.5', 'I have never gone from being able to move my limbs to being completely paralyzed before and it was odd. By 10am I was laying back on the operating table while they got all the instruments prepped and put up screens. I was also given a heat bubble (for lack of a better term) for my upper body to counter act any tremors.'), ('0.6', ""At 10:05 they let my husband come in and sit with me and I just stared at him trying to stay calm until they told me they were going to make the first cut. At 10:10 I was told they were making the first incision, a minute or two later they told me I would hear my waters being suctioned and at 10:14 husband and heard a tiny little gurgle followed by intense pressure and then a complete emptying of my stomach and the most amazing sound a parent can hear, their child's first cry. Both my husband and I lost it.""), ('0.7', 'I rarely see my husband cry and it was magical to see him completely let down his defenses. They wiped our little girl off and brought her over to my head for a quick snuggle and a kiss then my husband accompanied her to the nursery for her first bath and tests while I was stitched up. The time I spent getting stitched up and in recovery before seeing my daughter again was kind of a blur.'), ('0.8', 'I was so high on adrenaline that time just slipped by and before I knew it I was able to move my legs enough to be released from recovery and taken to meet my hubby and little girl. Aria Elizabeth was born Tuesday September 2nd at 10:14am at 38 weeks and 4 days gestation. She weighed 2.938 kilos and measured 46 cm at birth, both her 1 minute and 5 minute APGAR scores were 10.'), ('0.9', ""Not because of the pain, which wasn't that bad but because of the long hospital stay. I would have much rather been at home but I am glad I got some quality down time with my little lady and an excuse to do nothing but squish on my baby and heal. I was able to start breast feeding as soon as I was out of recovery and now, almost a week later, I think we have it down pretty well. If you made it this far, awesome and thanks for reading my extremely uneventful birth story. I was disappointed about having to have a c section at first but now that it's over and I have my daughter I don't even think about it. All that matters is that I am totally in love with this little bean that I created."")]"
Belated (and long) positive home birth story!,"[('0.3', '(Note: I did not believe such a thing was possible - but it is!) The pain was such an alien sensation; it wasn\'t like anything I\'ve ever experienced. My yoga breathing practice really helped me through it; I worked hard to visualize and think about opening (instead of clenching) through each contraction, and while it didn\'t make them anywhere near painless it did shift my perception of the sensation. My prenatal yoga teacher always said that contractions are a special kind of pain because they aren\'t going to hurt you, and as trite as that might sound, the reminder was useful in the moment. I kept repeating ""through the fire"" as my own personal mantra....'), ('0.4', ""This went on for several hours until they started to hear my vocalizations change and could tell I was heading for transition. At that point they gave me my first cervical check, and though they didn't tell me the number at the time I was almost fully dilated with just a small cervical lip remaining. They got me up and we made our way downstairs to the birth tub, and I spent about an hour or so in the tub, laboring through transition and into pushing. The water took the edge off and helped relax my back (I think I'd strained a muscle in it earlier), but I don't think I'd need to have the full-on tub experience if I ever go through labor again. After a while in the tub, it became clear that baby wasn't really descending (though heart tones were fine), and they had me get out of the tub and push with the assist of gravity.""), ('0.5', ""After a second cervical check, they decided my full bladder was in baby's way, so they catheterized and emptied it. Things moved pretty quickly after that! There was one push where they were finally able to see the top of her head (I'd been able to feel it with my fingers for quite some time, ever since I'd been in the tub), and at that point they started to move me back toward the tub so I could birth in the water. But that wasn't to be, because with the next push Linnea came fully out, head, shoulders, and body - and all over the carpet, because they weren't quite ready for her emergence so swiftly although they did catch her. Now we have a lovely new area rug in front of the couch downstairs!""), ('0.6', ""She was born with a huge caput (big bruise) on the left side of her head, so she'd been bumping into something while inside for a while. I ended up with a partial third degree internal tear and a technical hemorrhage, so had to leave after a couple of hours and get stitched up in the OR at the hospital nearby. That was perhaps more painful than labor, because they were all up in my vagina and rectum (the muscle and fascia between is where most of the tearing happened). I only accepted lidocaine so felt a lot of very intense pressure for the hour they were stitching. My husband was left all alone at home with Linnea during that time, and was a pro at soothing and caring for her right away.""), ('0.7', ""In retrospect, it's been funny to me that going into the process I told my midwives and doula that I wanted lots of information and to always know what was going on. When it played out in the moment, they didn't tell me a lot of things such as that my labor pattern was unpredictable and hard to read, that I was almost fully dilated at the first check, or when I was hitting transition. Instead, they attended to me but let my body and my own instincts kick in - and that's actually just what I needed. They were an amazing support team and I wish everyone could have such fantastic people around them for their birth, no matter the setting. In terms of the first couple of weeks, they've been up and down.""), ('0.8', ""Linnea had a very obvious tongue tie, so breastfeeding was very painful and stressful that first week. She had a huge poop when emerging at birth, but it was three more days before she pooped again and I was worried she wasn't getting enough milk. I was panicky and stressed about everything, and spent my days in the bed with her doing skin-to-skin. But after we got her tie released five days post-birth, breastfeeding improved and I'm feeling *much* better both mentally and physically. It's taken a couple of weeks to feel like I can read her signals more clearly, and to improve at latching - but it does get better, ladies!""), ('0.9', ""I can't say I love the newborn phase, but it's exciting to see her spend more time alert and looking around, and I can't wait for her little reflexive milk smiles to become real responsive ones."")]"
"From my previous account, Arden's home birth story.","[('0.3', ""I went into this labor with one unmedicated, intervention free birth behind me. With my son's birth I was calm and in control. I just went into myself, trusted my body and let my body labor as it needed. There was no fear, no resistance. It was so different this time. I don't even feel there was time to go into myself and when I did, I didn't want to be there. Everything escalated so quickly. While I was pregnant I told myself I was going to try and make my contractions as productive as possible. I was going to be proactive and push myself and knew it would be more painful, but the pain was a positive thing, it would bring my baby to me. I didn't even try to push my body, it just did it naturally. I was walking and standing the entire time, but that's as proactive as I became.""), ('0.4', ""The midwife arrived at 4 am and quickly started to sterilize her equipment. After seeing a contraction she realized I was much further along than she was expecting. The other midwife, who's practice it is, wasn't even called yet. This was also about the time things got very serious and the contractions started coming one on top of another. My husband was able to keep me breathing and calm through about one more contraction and that was it. I started to shake uncontrollably with every contraction and had to be reminded about my breathing, I was beginning to hyperventilate. I started having the urge to push so I asked for a pelvic exam. It was very difficult to lay down because of the pain it caused, but I learned I was about 7 1/2-8 cm dilated. It was 4:30 at this point. I had a few more good contractions, one that will take me a while to forget because it caused me to scream like I never had before. A scream that I didn't know my body could produce.""), ('0.5', ""I couldn't control the urge to push anymore. I was fearful my body wasn't dilated enough and I was just going to push and cause my cervix to swell and cause further problems. It had only been about 10 minutes since i was checked, but I didn't have a choice, my body was pushing. After a contraction I felt something dripping down my leg, I lifted my night gown and asked my husband what it was, I could see it though, I was starting to bleed. The contractions keep coming and I kept pushing, there was more blood and small chunks of something sliding down my leg. I could see the midwife was concerned and she started asking questions about my placenta and if i was ever told something, i don't remember what she asked, but I didn't have time to answer, another big contraction came and broke my water. My husband's and midwife's socks were soaked. The baby's heart rate was being monitored the entire time and everything looked good. After my water broke my husband said to me that the baby's going to be here soon. I didn't want to hear it, I didn't want to be in labor any more, I wanted to escape. Everything was progressing so fast, I didn't have time to think, to center myself, to remember to breath.""), ('0.6', ""I was just full of fear. Another contraction came and that one got the baby down to where I told my midwife the baby was coming. She checked me and said she didn't see the baby yet. Another contraction and she was crowning. I was planning to do this part slow, giving my body time to open and avoid tearing. Letting the contractions do most of the work... Nope. Again the overwhelming, irresistible need to bear down and push. It was painful, not relieving like at my son's birth. That ring of fire other's speak about, that was it. I felt like my body was splitting in two and there was nothing I could do to stop it. I just knew I was tearing.""), ('0.7', ""Her head being out brought so much relief, mentally I knew the hard part was over and my body seemed to calm down too, but now my midwife seemed concerned about something. She wanted me to get down on all fours, I said no, I was fine standing. She told my husband to get me down and I did. She told me it's time to get the baby out. I didn't understand why she was rushing me, she wouldn't tell me what was wrong. I tried pushing but felt like my body was doing nothing, absolutely nothing and a contraction just wouldn't come. I told her this and again she told me to push as hard as I could and to get the baby out. So I did, I pushed as hard as I could without a contraction and two pushes later, she was born. Right onto the floor full of blood and fluid and mecconium. She was responsive, but her cry was weak and barely there, so the midwife breathed into her and got her lungs going. She was quickly put to my chest and the love and joy instantly erased everything that just happened.""), ('0.8', ""At this time the other midwife arrived. The placenta was shortly delivered and we all got into bed, including the placenta, we did delayed cord cutting. I was still heavily bleeding and being monitored. I opted for the herbal supplement first and if the bleeding didn't calm down, I would get the pictocin. I was being watched closely. After nursing and resting a bit they took me into the bathroom to clean me up. It was in there that I started to faint because of the blood loss. I was put back into bed and ate some granola and took a nap with my new baby on my chest. I woke up to the sun shinning through my bedroom window, her first sunshine, while my husband and midwifes drank coffee in the living room. They house was filled with a great warmth. It's amazing how quickly holding your little baby makes it all worth it.""), ('0.9', '')]"
