title,stories
"Birth story! (home, unmedicated, midwife-assisted water-birth)","[('0.3', ""We frantically tied up all loose ends. We set out fruit, vegetables, dips; set up the change table; filled up the birth pool; swept the floors, etc. The hours of 5-7pm went by quickly. The contractions now commanded A's full attention  and she had to stop whatever she was doing to breathe through them. At this point, the castor oil was working too well and she was locked in the bathroom 3-4 times per hour while the contractions (from the beginning) occurred 2-3 minutes apart. The combination was unbearable.""), ('0.4', 'I was sent on a mission to get immodium. It was beyond painful to watch my partner suffer in tears as I ran out the door but I was back in a flash with the meds in hand. [This was against the advice of our midwife, who insisted that I suffer through it as the immodium would stop the intestinal contractions which were causing the uterine contractions, in other words, labour could stop. I disregarded this advice as I knew I couldn\'t go another hour with the way things had been. ] Between 7:30-8:30 contractions were lasting longer now (about 40 seconds) but not letting up in frequency at 2-3 minutes apart. We were not quite sure all along when to call the midwife as the contractions not once fit the ""4-1-1"" profile/protocol we were given.'), ('0.5', '[That is, 4 minutes apart, 1 minute long, for one hour or more.] We went with our instincts and phoned the midwife to request her assistance immediately as it was clear that the labour pattern was not allowing for breaks and A was eager to get in the pool for relief. Grace arrived shortly after we called her and immediately began her examinations and assessment of A. Contractions were holding steady at 2-3 minutes apart, 40 seconds long and were increasing in intensity. We began to try using different positions to ease the intensity -- standing, squatting, hands and knees, cat-cow. [The room was beautiful, from what I recall - we had a string of dim lights surrounding the pool, a playlist featuring tibetan mantras and Sigur Ros and the room was quiet, serene. Our midwife fit seamlessly with the ambience of it all.]'), ('0.6', ""At about 9:30-10:00pm our student-midwife Abigail arrived, just as A was getting in the pool. The pain immediately melted away. We now gathered around the pool, pouring bowls full of water over A's stomach during contractions to help ease the aches away. After 1-1.5 hours A needed the washroom (for the last time). Grace checked her progress. Unfortunately she hadn't dilated further than 5cm and Grace felt it was best to artificially rupture the membranes (break her waters) to bring the baby further into descent.""), ('0.7', ""[This is what I regret most about the birth, something I will explain later]. Abigail checked A as well. Everything seemed to be okay and \nshe smiled as she reported that the baby was spinning around on her hand. [We didn't know at the time but this meant that he had not fully decided on a position for birth. When he did, it was less than favourable as he chose posterior occiput (face-up), resulting in a very painful back labour.] Soon after, Grace proceeded in breaking the waters and this unleashed a fury of labour pains.""), ('0.8', 'A could not bear to lay down and upon standing through contractions, her knees would buckle. The intensity of pain seemed to have immediately doubled, if not tripled; tears were common and plenty. She needed pain relief more so now than at any point before and our only hope was the pool. She climbed back in with the help and support of the midwives, who were intermittently using reflexology, triggering points on her feet and toes. Looking back on the night, I can say that the following hour was the most difficult for me to watch. She began to transition and the pool seemed to provide little relief.'), ('0.9', 'She thrashed, pleaded for the hospital, pleaded for medication. She asked us to stop it, told us she did not want to give birth anymore, said this was the dumbest thing she had ever done, that endorphins were a lie. She told me to shut up as I tried to console her. She was abrupt with the midwives. She tried to climb out of the pool. She cried and finally had given up verbalizing. Contractions at this stage were 1.5 minutes long, with 1 minute or less rest between. She would thrash and scream uncontrollably and after the contraction her body would become limp, completely drained of energy. It was as if the uterine muscles controlled her body now, and mentally she had to go with it regardless of what she wanted. (continued in first comment)')]"
Planned home birth story--early! quick! intense! positive!,"[('0.3', ""Counter-force was helpful during that phase: I sat on the toilet (it felt like I had to poop at the same time--suuuuuper pleasant) and grasped my SO's arms while he stood in front of me to lean my head against and gave some counter-force by sort of pulling back against my arms. At that time, I had the bloody show. The good news is that the pain of contractions became less of a pain and more of an intensity and pressure after transition--I went to a distant, hazy trance land. Maybe you've heard the wave analogy for contractions before--I think it's pretty accurate: it was like being swept away. Once I could move, we went back into the living room, and my last position was laying on my side while he used his fist to put pressure on my hip. My partner started running around trying to air up the birthing pool--we knew it was close, but still thought we had time--but my contractions were hitting so close together that he couldn't really get anything done because I needed him to keep applying pressure.""), ('0.4', ""At about 1:50, my body started to push and my water broke--I felt something starting to come out, and I swear my SO has never taken my panties off so fast! I delivered part of my water sac still intact. That was pretty scary because I could tell something had come out that didn't feel like a baby should feel, and it was this weird uncomfortable pulling pressure. My SO got the midwife--who was barreling down the interstate from her home 25 minutes away--on speakerphone as he realized we were having a baby for real now. I remember his hands shaking and he was talking loud, telling the midwife what was happening while talking me through contractions and trying to keep me calm. She told him to tell me not to push, and I laughed because I couldn't stop the pushes!""), ('0.5', ""Happily, she got there soon after, a little after 2, and my partner didn't have to deliver our baby himself. He got into position with my head in his lap so I could curl into C-shape for pushing, and continued to coach me through it like a boss. I coached him back too, actually--it was a pretty great synthesis. For example, at one point, I didn't feel like I was doing great with my breath during contractions even though he was reminding me to breathe, so I told him to stop telling me to breathe and to just breathe with me to give me something to focus on more. I think for the next contraction, I told him the opposite, and we went back and forth a few times. I had read there's some connection between the jaw and everything going on down there during labor.""), ('0.6', 'Making low moans on exhales helped keep my jaw and body relaxed (well, ""relaxed"" is n\'t the best word, but...) enough to let baby come down between pushes. Baby\'s head was in the gap through 2 or 3 rounds of contractions, which didn\'t feel strong enough for me to get her out. But then as I felt the next one coming on, I told myself and my midwife, ""Okay, this is the one,"" bore down, and pushed our kid out in one rush. I could barely feel the contraction or even myself pushing, but my body did it. Our baby was born on our living room floor at 3:05 am on the 17th of November, pink and with clear airways. When the midwife placed her on my chest, I just laughed and laughed and laughed.'), ('0.7', 'We found out she was a baby girl, and she weighed 6 lbs. 12 oz and was 19.5 inches long. We hadn\'t even talked about names yet, but after a few days of imagining her as different combos, Evelynn Sylvia fit. Honestly, it was an amazing experience and, even though it wasn\'t perfect or particularly pleasant, I wouldn\'t change anything about it. You can do it too, whatever ""it"" looks like for you!!! I\'ve got a big little 8 lb.'), ('0.8', ""10 oz 7 week old napping in my arms, but I'll be happy to answer any questions you've got. ](http://imgur.com/a/T92ZY)""), ('0.9', '')]"
"Superlate birth story, at home and not medicated.","[('0.3', 'I didn\'t want to be checked during birth, because I (tried to) trust my body, so I didn\'t know how dilated I was. At 9pm, I felt horrible. I didn\'t know how to relax, because my contractions did hurt, and I asked my midwife: when do these endorphins come in to make the pain go away!? And my biggest fear happened: I vomited again, which was the point I lost all control with my first. But I had the most wonderful midwife I could wish for and she sat with me, asked my SO to sit behind me and rub my back, and she started telling me to stay calm. ""It\'s normal when your muscles cramp, that your stomach cramps too.'), ('0.4', 'Just relax again, it\'s no problem at all"". At that moment, the hormones started flowing and between the intens contractions, I started feeling high as hell. At 10pm I said I needed to pee badly and we went upstairs to go to the bathroom and bedroom. But I just couldn\'t pee anymore: I felt like I had to poop! She got me off the toilet and directed me to my bed. The plan was to lie down, but when I got on the bed on my hands and knees, there was no way I could move any further.'), ('0.5', ""At 10:30pm, I started to 'breath down' and tried not to push. Because of my position, I felt every tiny movement of the baby. I felt how he got a little further during a contraction, and how he would glide back in between. I wanted to feel everything of this special moment (how often do you give birth?) so I tried to stay calm. I started talking to the baby he was very welcome and could come out, but if he wanted to take his time, it would be ok too.""), ('0.6', ""And then the midwife said: I see his head... I see his shoulders... I see one arm... ok, he's allllmost there... \n\n\nAnd there he was, at 10:51pm! He was so perfect and tiny and I was so incredibly proud of him because he made it out. They put him on my chest to rest and unfortunately, I had second degree tearing so they had to stitch me. After 45 minutes, I let him crawl to my breast, and he latched on his own.""), ('0.7', ""I'm really happy with how the whole experience was, especially because my first labor was so fast and hectic. This time, it was really relaxed and I felt in control. Or maybe the other way around: I was completely ok with letting go this time, instead of wanting to be in control. So how about a few post partum tips? - The first weeks are hard. Fuck, they're hard.""), ('0.8', ""I don't mind giving birth, but these first weeks after birth: I don't like them. I could not sit, I could barely walk, baby cries for what seems like no reason, no sleep. But what I did do:\n\n- I showered everyday \n\n- I stayed in bed for four whole days to recover and relax with my baby (yeah, that was a hard one with a superactive toddler)\n\n- I asked for all the help I could get, because I didn't want go to that dark, dark place where I came when I had my first. Still having a rough time anyway. - I try to enjoy every moment (but that too, is incredibly hard with 4 hours sleep at night). - I carried my LO in a woven wrap after a week, to be able to do things with my toddler.""), ('0.9', 'Still hard with the clusterfeeding. If you have any questions about the hypnobirthing part - or any other part, ask away or pm me.')]"
What to do when your water breaks in a tent 4 hours from home- Our birth story and anniversary baby,"[('0.3', 'At this point I was having what felt like mild menstrual cramps too. The nurse said she would swab to see if it really was my water breaking, but when she saw how much fluid was on the pad she said ""nevermind, your water definitely broke!"" and they moved me to a birthing room. My mom arrived from the hotel she was staying at (she\'s gotten tired of camping after 40 years of it lol). My husband was guzzling water and coke to sober up and wake up (which he did quickly and was super supportive!) They did a cervical check and I was only a fingertip dilated. At this point I knew I would be having my baby soon since my water broke- they said that some hospitals give a firm 24 window, but they were comfortable going beyond that if everything seemed good, and that they would limit cervical checks to reduce risk of infection. At that point it finally hit me that I was having my baby 4 hours from home, and almost 3 weeks early! For the next few hours, my contractrions picked up. They went beyond painful menstrual cramps to really feeling my uterus tightening. The hospital had a lovely nature trail nearby, so we walked there and picked berries. It was so peaceful! Eventually my brothers came, and the whole family took another lovely nature walk.'), ('0.4', ""We were all cracking up at the whole situation- me picking berries and then grabbing trees and grunting when contractions hit. By dinner time the contractions were picking up. Luckily they let me eat, and I scarfed everything in front of me. At one point I tried to breath through a contraction while eating and sprayed a mouthful of pudding everywhere. My contractions had become less regular and less frquent, so they mentioned pitocin but said they'd wait. At this point I met the OB, who was amazing. Super supportive, listened to me, wonderful. A cervical check showed only 3 cm (I HATED the checks- they hurt so bad!). Before they tried pitocin, she wanted to try pumping to stimulate oxytocin instead. Pumping definitely worked, becayuse a huge contraction hit as I was in bed holding the pumps on. All I wanted to do was drop them and curl up, but I held on because I didn't want to waste all that good colostrum. It was awful, but cool to feel like I was doing it for my baby. When the contractions picked up, I was struggling.""), ('0.5', 'I would lean forward, grunt and groan and have mom or hubby push on my back. I wasn\'t sure if I would want my mom there, but I was so glad she stayed- having two support people was awesome. I was really trying to stay relaxed through the contractions, which was hard. My mom kept reminding me to relax my face and hands. I would wiggle my fingers and open my eyes and mouth really wide- I said I looked like a surprised wizard casting spells. The contractions were different from what I expected- they happen to you, if that makes sense, and you jut have to exist through them as they come. I threw up at that poiunt, and apparently said ""oh no, my noodles"" when I looked at the puke. I decided I wanted an epidural, which I had been open to from the start (I never really had much of a birth plan- I\'m not a planner.) The epi went in fine- a few contractiosn hit during, which was really hard to stay still for and some of the worst part, but I felt no pain from the epi itself. Relief was fast, and I dozed from 10:30-5. Honestly I can\'t imagine having gone through it all without that relief. I was worried about having a catheter, but rather than leave one in they just inserted it when I had a full bladder- no pain or discomfort at all! When they put in the IV for the epi, they also did pitocin as well since my contyractions were still irregular.'), ('0.6', 'The next morning they came back to check, and I was nervous because I knew the contractions weren\'t doing what they were supposed to still. I was really nervous I\'d need a C section. The Ob went to check me again, and I never even felt it- yay epi! She said ""OK, we\'re ready to push!"" I was beyond 9 cm dilated. I LOVED the ob. She made me feel so empowered and ready, and let me know I was in control and had the power- she was just there to help. They showed me how to push, and I got to it. COntractions happen to you, pushing is something you do. I also had the perfect balance with the epi- no pain at all, but I could move around. I pushed on all fours in bed, crouched and leaning on the bed, and on my back but somewhat upright. It was amazing- I was worried about the epi taking away feeling and movement, but it was perfect. (I also realize this isn\'t always the case so I count myself lucky for sure.)'), ('0.7', 'I could see everything in the reflection of a light above the bed that they directed another light at for me so I could see. When her head started to show, the look on my husbands face was the greatest thing I\'ve ever seen. I can\'t describe it. Once everyone could see that, I just wanted to meet her! They had me try to do 3 pushes per contraction, but my contractions were unusually long so I could do 4-5 most times. When I was pushing nothing else got through. I just remember being so in the moment and the motion. I feel like I drew on the same resources physically and emotionally that I did as an athlete- pushing beyond what you think you can do. Ring of fire wasn\'t too bad, I was aware of the pain but it felt remote. When her head came out, the rest slid so fast and they put her right on me. I remember trying to see her face and I remember my husbands expression but it\'s all kind of a blur now. she had some issues at first where she wasn\'t really crying and they were a little worried, but it was ok.\n\nAs for delivering the placenta- when my husband was telling his sister about it, he said ""have you ever seen a potato canon?"" There was blood and fluid everyhwere- they were wiping it off the walls and the ob asked a nurse if it was on her face.'), ('0.8', 'I didn\'t realize til later this wasn\'t always the case. I had 2 stitches, and was back on my feet by afternoon. Water broke at 2 am saturday, admitted 3 am, epi and pitocin 10 pm, started pushing at 7:45 and delivered at 9:19 on July 26, our one year wedding anniversary!. Ate lunch and peed on my own at noon. One of the first things I said to  my husband was ""Let\'s have another one!"" I had an amazing pregnancy- I was nauseous, I barfed, I lost weight, I peed myself, but I just loved being pregnant. I got all the euphoria hormones. To be honest I was a little sad to not be pregnant anymore- I never made it to the point of feeling like ugh, when will this end. The delivery was also such a positive, empowering feeling. I feel like a freaking goddess- powerful, wonderful. I never loved my body more than I did when I was pregnant- until I delivered. So even though I started this journey crouched in a forest watering the moss with amniotic fluid and thinking ""aw, crap, my husband is drunk!\' it was overall extremely positive.'), ('0.9', ""Hoping to post some post-partum stuff at some point too! I already posted a picture a few days ago, and can't figure out how to link it here, so check my post history if you want to see my hairy hairy baby (seriously, she's adorable, but it was like monkey level.) Last  bit of advice- DO NOT PROCRASTINATE! We are chronic procrastonators, and felt like we had so much time. Having to deep clean the house, prep a nursery, buy a car, and figure out insurance with a newborn is not recomended. I think she came early to forever cure us of our lateness. This has been the best community to be a part of- thank you for all the advice, support, laughs, and tears. I'll still hang around here, but I'll see some of you on /r/rbeyondthebump!"")]"
I had a baby yesterday! Here is my home birth story + baby pics,"[('0.3', ""We listened to music and chatted and I leaned on my husband and my sister put the rice bag on during the contractions. The midwives checked me and I was 7cm dilated so they decided to stay. I decided to get in the bath. After 15 minutes in the bath I hadn't had another contraction so the midwives kicked me out to go on another walk. It worked, and after just a few laps around the block I was having such strong contractions that I wanted to go back home! We got back around 5:30 and ny husband made hotdogs for the kids. Midwives checked and I was almost dilated but for a small cervical lip. I was feeling lots of pressure.""), ('0.4', ""I'd say this is when I stopped having fun. My contractions were sporadic, but when they hit, they were STRONG. My sister and I rated my contractions on a scale- Fresh, Minty, Spicy, Hot Tamale or 5 alarm. These were some Hot Tamale contractions! My midwife and student called the backup midwife and student. After another hour the midwives checked me again and I was *still* mostly dilated but with a cervical lip. But my contraction pattern was stalled. They thought maybe baby wasn't in a good position so I did a bunch of different postions- hands and knees and swivelling.""), ('0.5', ""At this point I was feeling a ton of pressure and miserable. I told the midwives I was quitting. Q U I T. Done. I was really frustrated. We decided if I hadn't progressed by 7 they would break my water. 7pm rolled around, I was miserable and frustrated and still had the cervical lip so my midwife broke my water. I walked around and was still having only occasional contractions and lots that seemed to start but didn't. Again we tried different positions.""), ('0.6', ""I was fed up and asked to go in the shower. I got in the shower and it was sooooo nice. My sister and I were singing and chatting and the pain vanished..... and so did my contractions! After 15 minutes the midwives fished me out again and told me I really had to start pushing even if I wasn't having contractions because baby might get fed up soon. I felt like pushing but cripes I hate pushing. I lay down on the bed and we determined the cervical lip was gone. I asked for the birth stool. My midwife sent my mom out to the car to get it.""), ('0.7', ""I was still lying there when the next contraction hit, but the urge to push was suddenly strong. So I pushed a little. I yelled out that I had to go to the bathroom and the midwives said not to worry, just push, everyone poos they've seen it all. And I pooped, and I really didn't care. I got that whole baby out in 40 seconds apparently but it sure seemed a lot longer. I SCREAMED the whole baby out. With my other kids who were small, once their heads were out and shoulders that was pretty much it. This one I had to push out head, shoulders, belly and bum.""), ('0.8', ""But then out came Felicity! My poor Mom missed the whole thing because she was on her way to get the birth stool. She said she could hear me screaming from outside! Baby was born at 7:31pm\n\nThe midwives put her right on my chest. We were all stunned by how big she was! I'd measured small my whole pregnancy and my belly never grew to more than 35cms. The placenta was delivered and I was checked for tears (no tears, yay!) and then we got baby latched on.""), ('0.9', ""After she'd eaten we brought in the kids to meet her and they were absolutely in awe. It was such a sweet moment! my husband put the kids in jammies and in bed and then we had baby weighed. My biggest baby was 7lb2oz- she was a full pound and a half bigger at 8lbs10oz. She is sweet as can be and we are doing so well! I just love her to pieces! Here are some pics:\n\nright after birth http://imgur.com/f95ZT2b\n\nthis morning http://imgur.com/icW33DJ"")]"
